<?xml version="1.0" encoding="UTF-8" ?>
<!DOCTYPE table
[
  <!ELEMENT table	(tuple)*>
  <!ATTLIST table
            name	CDATA #REQUIRED
  >

  <!ELEMENT tuple	(table|tuple|atom)*>
  <!ATTLIST tuple
            name	CDATA #IMPLIED
  >

  <!ELEMENT atom	(#PCDATA)*>
  <!ATTLIST atom
            name	CDATA #REQUIRED
            type	CDATA "text"
            size	CDATA "short"
  >
]
>
<?schema
  table           egroups
    integer         irn
    text short      GroupName
    text short      GroupType
    text long       Query
    table           Keys_tab
      integer         Keys
    end
    table           SecDepartment_tab
      text short      SecDepartment
    end
  end
?>
<!-- Data -->
<table name="egroups">

  <!-- Row 1 -->
  <tuple>
    <atom name="irn">13173</atom>
    <atom name="GroupName">RI-31 Birds Photos</atom>
    <atom name="GroupType">Static</atom>
    <atom name="Query"></atom>
    <table name="Keys_tab">
      <tuple>
        <atom name="Keys">2192016</atom>
      </tuple>
      <tuple>
        <atom name="Keys">2192027</atom>
      </tuple>
      <tuple>
        <atom name="Keys">2192020</atom>
      </tuple>
      <tuple>
        <atom name="Keys">2192018</atom>
      </tuple>
      <tuple>
        <atom name="Keys">2192022</atom>
      </tuple>
      <tuple>
        <atom name="Keys">2192010</atom>
      </tuple>
      <tuple>
        <atom name="Keys">2192025</atom>
      </tuple>
      <tuple>
        <atom name="Keys">2192011</atom>
      </tuple>
      <tuple>
        <atom name="Keys">2192001</atom>
      </tuple>
      <tuple>
        <atom name="Keys">2192017</atom>
      </tuple>
      <tuple>
        <atom name="Keys">2192030</atom>
      </tuple>
      <tuple>
        <atom name="Keys">2192029</atom>
      </tuple>
      <tuple>
        <atom name="Keys">2192023</atom>
      </tuple>
      <tuple>
        <atom name="Keys">2192021</atom>
      </tuple>
      <tuple>
        <atom name="Keys">2192019</atom>
      </tuple>
      <tuple>
        <atom name="Keys">2192015</atom>
      </tuple>
      <tuple>
        <atom name="Keys">2192014</atom>
      </tuple>
      <tuple>
        <atom name="Keys">2192002</atom>
      </tuple>
      <tuple>
        <atom name="Keys">2192012</atom>
      </tuple>
      <tuple>
        <atom name="Keys">2192009</atom>
      </tuple>
      <tuple>
        <atom name="Keys">2192003</atom>
      </tuple>
      <tuple>
        <atom name="Keys">2192026</atom>
      </tuple>
    </table>
    <table name="SecDepartment_tab">
      <tuple>
        <atom name="SecDepartment">Action</atom>
      </tuple>
    </table>
  </tuple>

  <!-- Row 2 -->
  <tuple>
    <atom name="irn">15093</atom>
    <atom name="GroupName">RI-21 Overflight Photos</atom>
    <atom name="GroupType">Static</atom>
    <atom name="Query"></atom>
    <table name="Keys_tab">
      <tuple>
        <atom name="Keys">2315349</atom>
      </tuple>
      <tuple>
        <atom name="Keys">2315350</atom>
      </tuple>
      <tuple>
        <atom name="Keys">2315351</atom>
      </tuple>
      <tuple>
        <atom name="Keys">2315352</atom>
      </tuple>
      <tuple>
        <atom name="Keys">2315353</atom>
      </tuple>
      <tuple>
        <atom name="Keys">2315354</atom>
      </tuple>
      <tuple>
        <atom name="Keys">2315355</atom>
      </tuple>
      <tuple>
        <atom name="Keys">2315356</atom>
      </tuple>
      <tuple>
        <atom name="Keys">2315357</atom>
      </tuple>
      <tuple>
        <atom name="Keys">2315358</atom>
      </tuple>
      <tuple>
        <atom name="Keys">2315359</atom>
      </tuple>
      <tuple>
        <atom name="Keys">2315360</atom>
      </tuple>
      <tuple>
        <atom name="Keys">2315361</atom>
      </tuple>
      <tuple>
        <atom name="Keys">2315362</atom>
      </tuple>
      <tuple>
        <atom name="Keys">2315363</atom>
      </tuple>
      <tuple>
        <atom name="Keys">2315364</atom>
      </tuple>
      <tuple>
        <atom name="Keys">2315365</atom>
      </tuple>
      <tuple>
        <atom name="Keys">2315366</atom>
      </tuple>
      <tuple>
        <atom name="Keys">2315367</atom>
      </tuple>
      <tuple>
        <atom name="Keys">2315368</atom>
      </tuple>
      <tuple>
        <atom name="Keys">2315369</atom>
      </tuple>
      <tuple>
        <atom name="Keys">2315370</atom>
      </tuple>
      <tuple>
        <atom name="Keys">2315371</atom>
      </tuple>
      <tuple>
        <atom name="Keys">2315372</atom>
      </tuple>
      <tuple>
        <atom name="Keys">2315373</atom>
      </tuple>
      <tuple>
        <atom name="Keys">2315374</atom>
      </tuple>
      <tuple>
        <atom name="Keys">2315375</atom>
      </tuple>
      <tuple>
        <atom name="Keys">2315376</atom>
      </tuple>
      <tuple>
        <atom name="Keys">2315377</atom>
      </tuple>
      <tuple>
        <atom name="Keys">2315378</atom>
      </tuple>
      <tuple>
        <atom name="Keys">2315379</atom>
      </tuple>
      <tuple>
        <atom name="Keys">2315380</atom>
      </tuple>
      <tuple>
        <atom name="Keys">2315381</atom>
      </tuple>
      <tuple>
        <atom name="Keys">2315382</atom>
      </tuple>
      <tuple>
        <atom name="Keys">2315383</atom>
      </tuple>
      <tuple>
        <atom name="Keys">2315384</atom>
      </tuple>
      <tuple>
        <atom name="Keys">2315385</atom>
      </tuple>
      <tuple>
        <atom name="Keys">2315386</atom>
      </tuple>
      <tuple>
        <atom name="Keys">2315387</atom>
      </tuple>
      <tuple>
        <atom name="Keys">2315388</atom>
      </tuple>
      <tuple>
        <atom name="Keys">2315389</atom>
      </tuple>
      <tuple>
        <atom name="Keys">2315390</atom>
      </tuple>
      <tuple>
        <atom name="Keys">2315391</atom>
      </tuple>
      <tuple>
        <atom name="Keys">2315392</atom>
      </tuple>
      <tuple>
        <atom name="Keys">2315393</atom>
      </tuple>
      <tuple>
        <atom name="Keys">2315394</atom>
      </tuple>
      <tuple>
        <atom name="Keys">2315395</atom>
      </tuple>
      <tuple>
        <atom name="Keys">2315396</atom>
      </tuple>
      <tuple>
        <atom name="Keys">2315397</atom>
      </tuple>
      <tuple>
        <atom name="Keys">2315398</atom>
      </tuple>
      <tuple>
        <atom name="Keys">2315399</atom>
      </tuple>
      <tuple>
        <atom name="Keys">2315400</atom>
      </tuple>
      <tuple>
        <atom name="Keys">2315401</atom>
      </tuple>
      <tuple>
        <atom name="Keys">2315402</atom>
      </tuple>
      <tuple>
        <atom name="Keys">2315403</atom>
      </tuple>
      <tuple>
        <atom name="Keys">2315404</atom>
      </tuple>
      <tuple>
        <atom name="Keys">2315405</atom>
      </tuple>
      <tuple>
        <atom name="Keys">2315406</atom>
      </tuple>
      <tuple>
        <atom name="Keys">2315407</atom>
      </tuple>
      <tuple>
        <atom name="Keys">2315408</atom>
      </tuple>
      <tuple>
        <atom name="Keys">2315409</atom>
      </tuple>
      <tuple>
        <atom name="Keys">2315410</atom>
      </tuple>
      <tuple>
        <atom name="Keys">2315411</atom>
      </tuple>
      <tuple>
        <atom name="Keys">2315412</atom>
      </tuple>
      <tuple>
        <atom name="Keys">2315413</atom>
      </tuple>
      <tuple>
        <atom name="Keys">2315414</atom>
      </tuple>
      <tuple>
        <atom name="Keys">2315415</atom>
      </tuple>
      <tuple>
        <atom name="Keys">2315416</atom>
      </tuple>
      <tuple>
        <atom name="Keys">2315529</atom>
      </tuple>
      <tuple>
        <atom name="Keys">2315418</atom>
      </tuple>
      <tuple>
        <atom name="Keys">2315419</atom>
      </tuple>
      <tuple>
        <atom name="Keys">2315420</atom>
      </tuple>
      <tuple>
        <atom name="Keys">2315421</atom>
      </tuple>
      <tuple>
        <atom name="Keys">2315422</atom>
      </tuple>
      <tuple>
        <atom name="Keys">2315423</atom>
      </tuple>
      <tuple>
        <atom name="Keys">2315424</atom>
      </tuple>
      <tuple>
        <atom name="Keys">2315425</atom>
      </tuple>
      <tuple>
        <atom name="Keys">2315426</atom>
      </tuple>
      <tuple>
        <atom name="Keys">2315427</atom>
      </tuple>
      <tuple>
        <atom name="Keys">2315428</atom>
      </tuple>
      <tuple>
        <atom name="Keys">2315429</atom>
      </tuple>
      <tuple>
        <atom name="Keys">2315430</atom>
      </tuple>
      <tuple>
        <atom name="Keys">2315431</atom>
      </tuple>
      <tuple>
        <atom name="Keys">2315432</atom>
      </tuple>
      <tuple>
        <atom name="Keys">2315433</atom>
      </tuple>
      <tuple>
        <atom name="Keys">2315434</atom>
      </tuple>
      <tuple>
        <atom name="Keys">2315435</atom>
      </tuple>
      <tuple>
        <atom name="Keys">2315436</atom>
      </tuple>
      <tuple>
        <atom name="Keys">2315437</atom>
      </tuple>
      <tuple>
        <atom name="Keys">2315438</atom>
      </tuple>
      <tuple>
        <atom name="Keys">2315439</atom>
      </tuple>
      <tuple>
        <atom name="Keys">2315440</atom>
      </tuple>
      <tuple>
        <atom name="Keys">2315441</atom>
      </tuple>
      <tuple>
        <atom name="Keys">2315442</atom>
      </tuple>
      <tuple>
        <atom name="Keys">2315443</atom>
      </tuple>
      <tuple>
        <atom name="Keys">2315444</atom>
      </tuple>
      <tuple>
        <atom name="Keys">2315445</atom>
      </tuple>
      <tuple>
        <atom name="Keys">2315446</atom>
      </tuple>
      <tuple>
        <atom name="Keys">2315447</atom>
      </tuple>
      <tuple>
        <atom name="Keys">2315448</atom>
      </tuple>
      <tuple>
        <atom name="Keys">2315449</atom>
      </tuple>
      <tuple>
        <atom name="Keys">2315450</atom>
      </tuple>
      <tuple>
        <atom name="Keys">2315451</atom>
      </tuple>
      <tuple>
        <atom name="Keys">2315452</atom>
      </tuple>
      <tuple>
        <atom name="Keys">2315453</atom>
      </tuple>
      <tuple>
        <atom name="Keys">2315454</atom>
      </tuple>
      <tuple>
        <atom name="Keys">2315455</atom>
      </tuple>
      <tuple>
        <atom name="Keys">2315456</atom>
      </tuple>
      <tuple>
        <atom name="Keys">2315457</atom>
      </tuple>
      <tuple>
        <atom name="Keys">2315458</atom>
      </tuple>
      <tuple>
        <atom name="Keys">2315459</atom>
      </tuple>
      <tuple>
        <atom name="Keys">2315460</atom>
      </tuple>
      <tuple>
        <atom name="Keys">2315461</atom>
      </tuple>
      <tuple>
        <atom name="Keys">2315462</atom>
      </tuple>
      <tuple>
        <atom name="Keys">2315463</atom>
      </tuple>
      <tuple>
        <atom name="Keys">2315464</atom>
      </tuple>
      <tuple>
        <atom name="Keys">2315465</atom>
      </tuple>
      <tuple>
        <atom name="Keys">2315466</atom>
      </tuple>
      <tuple>
        <atom name="Keys">2315467</atom>
      </tuple>
      <tuple>
        <atom name="Keys">2315468</atom>
      </tuple>
      <tuple>
        <atom name="Keys">2315469</atom>
      </tuple>
      <tuple>
        <atom name="Keys">2315470</atom>
      </tuple>
      <tuple>
        <atom name="Keys">2315471</atom>
      </tuple>
      <tuple>
        <atom name="Keys">2315472</atom>
      </tuple>
      <tuple>
        <atom name="Keys">2315473</atom>
      </tuple>
      <tuple>
        <atom name="Keys">2315474</atom>
      </tuple>
      <tuple>
        <atom name="Keys">2315475</atom>
      </tuple>
      <tuple>
        <atom name="Keys">2315476</atom>
      </tuple>
      <tuple>
        <atom name="Keys">2315477</atom>
      </tuple>
      <tuple>
        <atom name="Keys">2315478</atom>
      </tuple>
      <tuple>
        <atom name="Keys">2315479</atom>
      </tuple>
      <tuple>
        <atom name="Keys">2315480</atom>
      </tuple>
      <tuple>
        <atom name="Keys">2315481</atom>
      </tuple>
      <tuple>
        <atom name="Keys">2315482</atom>
      </tuple>
      <tuple>
        <atom name="Keys">2315483</atom>
      </tuple>
      <tuple>
        <atom name="Keys">2315484</atom>
      </tuple>
      <tuple>
        <atom name="Keys">2315485</atom>
      </tuple>
      <tuple>
        <atom name="Keys">2315486</atom>
      </tuple>
      <tuple>
        <atom name="Keys">2315487</atom>
      </tuple>
      <tuple>
        <atom name="Keys">2315488</atom>
      </tuple>
      <tuple>
        <atom name="Keys">2315489</atom>
      </tuple>
      <tuple>
        <atom name="Keys">2315490</atom>
      </tuple>
      <tuple>
        <atom name="Keys">2315491</atom>
      </tuple>
      <tuple>
        <atom name="Keys">2315492</atom>
      </tuple>
      <tuple>
        <atom name="Keys">2315493</atom>
      </tuple>
      <tuple>
        <atom name="Keys">2315494</atom>
      </tuple>
      <tuple>
        <atom name="Keys">2315495</atom>
      </tuple>
      <tuple>
        <atom name="Keys">2315496</atom>
      </tuple>
      <tuple>
        <atom name="Keys">2315497</atom>
      </tuple>
      <tuple>
        <atom name="Keys">2315498</atom>
      </tuple>
      <tuple>
        <atom name="Keys">2315499</atom>
      </tuple>
      <tuple>
        <atom name="Keys">2315500</atom>
      </tuple>
      <tuple>
        <atom name="Keys">2315501</atom>
      </tuple>
      <tuple>
        <atom name="Keys">2315502</atom>
      </tuple>
      <tuple>
        <atom name="Keys">2315503</atom>
      </tuple>
      <tuple>
        <atom name="Keys">2315504</atom>
      </tuple>
      <tuple>
        <atom name="Keys">2315505</atom>
      </tuple>
      <tuple>
        <atom name="Keys">2315506</atom>
      </tuple>
      <tuple>
        <atom name="Keys">2315507</atom>
      </tuple>
      <tuple>
        <atom name="Keys">2315508</atom>
      </tuple>
      <tuple>
        <atom name="Keys">2315509</atom>
      </tuple>
      <tuple>
        <atom name="Keys">2315510</atom>
      </tuple>
      <tuple>
        <atom name="Keys">2315511</atom>
      </tuple>
      <tuple>
        <atom name="Keys">2315512</atom>
      </tuple>
      <tuple>
        <atom name="Keys">2315513</atom>
      </tuple>
      <tuple>
        <atom name="Keys">2315514</atom>
      </tuple>
      <tuple>
        <atom name="Keys">2315515</atom>
      </tuple>
      <tuple>
        <atom name="Keys">2315516</atom>
      </tuple>
      <tuple>
        <atom name="Keys">2315517</atom>
      </tuple>
      <tuple>
        <atom name="Keys">2315518</atom>
      </tuple>
      <tuple>
        <atom name="Keys">2315519</atom>
      </tuple>
      <tuple>
        <atom name="Keys">2315520</atom>
      </tuple>
      <tuple>
        <atom name="Keys">2315521</atom>
      </tuple>
      <tuple>
        <atom name="Keys">2315522</atom>
      </tuple>
      <tuple>
        <atom name="Keys">2323215</atom>
      </tuple>
      <tuple>
        <atom name="Keys">2323216</atom>
      </tuple>
      <tuple>
        <atom name="Keys">2323217</atom>
      </tuple>
      <tuple>
        <atom name="Keys">2323218</atom>
      </tuple>
      <tuple>
        <atom name="Keys">2323219</atom>
      </tuple>
      <tuple>
        <atom name="Keys">2323220</atom>
      </tuple>
      <tuple>
        <atom name="Keys">2323221</atom>
      </tuple>
      <tuple>
        <atom name="Keys">2323222</atom>
      </tuple>
      <tuple>
        <atom name="Keys">2323223</atom>
      </tuple>
      <tuple>
        <atom name="Keys">2323224</atom>
      </tuple>
      <tuple>
        <atom name="Keys">2323225</atom>
      </tuple>
      <tuple>
        <atom name="Keys">2323226</atom>
      </tuple>
      <tuple>
        <atom name="Keys">2323227</atom>
      </tuple>
      <tuple>
        <atom name="Keys">2323228</atom>
      </tuple>
      <tuple>
        <atom name="Keys">2323229</atom>
      </tuple>
      <tuple>
        <atom name="Keys">2323230</atom>
      </tuple>
      <tuple>
        <atom name="Keys">2323231</atom>
      </tuple>
      <tuple>
        <atom name="Keys">2323232</atom>
      </tuple>
      <tuple>
        <atom name="Keys">2323233</atom>
      </tuple>
      <tuple>
        <atom name="Keys">2323234</atom>
      </tuple>
      <tuple>
        <atom name="Keys">2323235</atom>
      </tuple>
      <tuple>
        <atom name="Keys">2323236</atom>
      </tuple>
      <tuple>
        <atom name="Keys">2323237</atom>
      </tuple>
      <tuple>
        <atom name="Keys">2323238</atom>
      </tuple>
      <tuple>
        <atom name="Keys">2323239</atom>
      </tuple>
      <tuple>
        <atom name="Keys">2323240</atom>
      </tuple>
      <tuple>
        <atom name="Keys">2323241</atom>
      </tuple>
      <tuple>
        <atom name="Keys">2323242</atom>
      </tuple>
      <tuple>
        <atom name="Keys">2323243</atom>
      </tuple>
      <tuple>
        <atom name="Keys">2323244</atom>
      </tuple>
      <tuple>
        <atom name="Keys">2323245</atom>
      </tuple>
      <tuple>
        <atom name="Keys">2323246</atom>
      </tuple>
      <tuple>
        <atom name="Keys">2323247</atom>
      </tuple>
      <tuple>
        <atom name="Keys">2323248</atom>
      </tuple>
      <tuple>
        <atom name="Keys">2323249</atom>
      </tuple>
      <tuple>
        <atom name="Keys">2323250</atom>
      </tuple>
      <tuple>
        <atom name="Keys">2323251</atom>
      </tuple>
      <tuple>
        <atom name="Keys">2323271</atom>
      </tuple>
      <tuple>
        <atom name="Keys">2323272</atom>
      </tuple>
      <tuple>
        <atom name="Keys">2323273</atom>
      </tuple>
      <tuple>
        <atom name="Keys">2323274</atom>
      </tuple>
      <tuple>
        <atom name="Keys">2323275</atom>
      </tuple>
      <tuple>
        <atom name="Keys">2323276</atom>
      </tuple>
      <tuple>
        <atom name="Keys">2323277</atom>
      </tuple>
      <tuple>
        <atom name="Keys">2323278</atom>
      </tuple>
      <tuple>
        <atom name="Keys">2323279</atom>
      </tuple>
      <tuple>
        <atom name="Keys">2323280</atom>
      </tuple>
      <tuple>
        <atom name="Keys">2323281</atom>
      </tuple>
      <tuple>
        <atom name="Keys">2323282</atom>
      </tuple>
      <tuple>
        <atom name="Keys">2323283</atom>
      </tuple>
      <tuple>
        <atom name="Keys">2323284</atom>
      </tuple>
      <tuple>
        <atom name="Keys">2323285</atom>
      </tuple>
      <tuple>
        <atom name="Keys">2323286</atom>
      </tuple>
      <tuple>
        <atom name="Keys">2323287</atom>
      </tuple>
      <tuple>
        <atom name="Keys">2323288</atom>
      </tuple>
      <tuple>
        <atom name="Keys">2323289</atom>
      </tuple>
      <tuple>
        <atom name="Keys">2323290</atom>
      </tuple>
      <tuple>
        <atom name="Keys">2323291</atom>
      </tuple>
      <tuple>
        <atom name="Keys">2323292</atom>
      </tuple>
      <tuple>
        <atom name="Keys">2323293</atom>
      </tuple>
      <tuple>
        <atom name="Keys">2323294</atom>
      </tuple>
      <tuple>
        <atom name="Keys">2323295</atom>
      </tuple>
      <tuple>
        <atom name="Keys">2323296</atom>
      </tuple>
      <tuple>
        <atom name="Keys">2323297</atom>
      </tuple>
      <tuple>
        <atom name="Keys">2323298</atom>
      </tuple>
      <tuple>
        <atom name="Keys">2323299</atom>
      </tuple>
      <tuple>
        <atom name="Keys">2323300</atom>
      </tuple>
      <tuple>
        <atom name="Keys">2323301</atom>
      </tuple>
      <tuple>
        <atom name="Keys">2323302</atom>
      </tuple>
      <tuple>
        <atom name="Keys">2323303</atom>
      </tuple>
      <tuple>
        <atom name="Keys">2323304</atom>
      </tuple>
      <tuple>
        <atom name="Keys">2323305</atom>
      </tuple>
      <tuple>
        <atom name="Keys">2323306</atom>
      </tuple>
      <tuple>
        <atom name="Keys">2323307</atom>
      </tuple>
      <tuple>
        <atom name="Keys">2323308</atom>
      </tuple>
      <tuple>
        <atom name="Keys">2323309</atom>
      </tuple>
      <tuple>
        <atom name="Keys">2323310</atom>
      </tuple>
      <tuple>
        <atom name="Keys">2323311</atom>
      </tuple>
      <tuple>
        <atom name="Keys">2323312</atom>
      </tuple>
      <tuple>
        <atom name="Keys">2323313</atom>
      </tuple>
      <tuple>
        <atom name="Keys">2323314</atom>
      </tuple>
      <tuple>
        <atom name="Keys">2323315</atom>
      </tuple>
      <tuple>
        <atom name="Keys">2323316</atom>
      </tuple>
      <tuple>
        <atom name="Keys">2323317</atom>
      </tuple>
      <tuple>
        <atom name="Keys">2323318</atom>
      </tuple>
      <tuple>
        <atom name="Keys">2323319</atom>
      </tuple>
      <tuple>
        <atom name="Keys">2323320</atom>
      </tuple>
    </table>
    <table name="SecDepartment_tab">
      <tuple>
        <atom name="SecDepartment">Action</atom>
      </tuple>
    </table>
  </tuple>

  <!-- Row 3 -->
  <tuple>
    <atom name="irn">14287</atom>
    <atom name="GroupName">FELI 2013</atom>
    <atom name="GroupType">Static</atom>
    <atom name="Query"></atom>
    <table name="Keys_tab">
      <tuple>
        <atom name="Keys">2249344</atom>
      </tuple>
      <tuple>
        <atom name="Keys">2249345</atom>
      </tuple>
      <tuple>
        <atom name="Keys">2249346</atom>
      </tuple>
      <tuple>
        <atom name="Keys">2249347</atom>
      </tuple>
      <tuple>
        <atom name="Keys">2249348</atom>
      </tuple>
      <tuple>
        <atom name="Keys">2249349</atom>
      </tuple>
      <tuple>
        <atom name="Keys">2249350</atom>
      </tuple>
      <tuple>
        <atom name="Keys">2249351</atom>
      </tuple>
      <tuple>
        <atom name="Keys">2249352</atom>
      </tuple>
      <tuple>
        <atom name="Keys">2249353</atom>
      </tuple>
      <tuple>
        <atom name="Keys">2249354</atom>
      </tuple>
      <tuple>
        <atom name="Keys">2249355</atom>
      </tuple>
      <tuple>
        <atom name="Keys">2249356</atom>
      </tuple>
      <tuple>
        <atom name="Keys">2249357</atom>
      </tuple>
      <tuple>
        <atom name="Keys">2249358</atom>
      </tuple>
      <tuple>
        <atom name="Keys">2249361</atom>
      </tuple>
      <tuple>
        <atom name="Keys">2249362</atom>
      </tuple>
      <tuple>
        <atom name="Keys">2249363</atom>
      </tuple>
      <tuple>
        <atom name="Keys">2249364</atom>
      </tuple>
      <tuple>
        <atom name="Keys">2249365</atom>
      </tuple>
      <tuple>
        <atom name="Keys">2249366</atom>
      </tuple>
      <tuple>
        <atom name="Keys">2249367</atom>
      </tuple>
      <tuple>
        <atom name="Keys">2249368</atom>
      </tuple>
      <tuple>
        <atom name="Keys">2249370</atom>
      </tuple>
      <tuple>
        <atom name="Keys">2249371</atom>
      </tuple>
      <tuple>
        <atom name="Keys">2249372</atom>
      </tuple>
      <tuple>
        <atom name="Keys">2249373</atom>
      </tuple>
      <tuple>
        <atom name="Keys">2249374</atom>
      </tuple>
      <tuple>
        <atom name="Keys">2249375</atom>
      </tuple>
      <tuple>
        <atom name="Keys">2249377</atom>
      </tuple>
      <tuple>
        <atom name="Keys">2249378</atom>
      </tuple>
      <tuple>
        <atom name="Keys">2249379</atom>
      </tuple>
      <tuple>
        <atom name="Keys">2249380</atom>
      </tuple>
      <tuple>
        <atom name="Keys">2249381</atom>
      </tuple>
      <tuple>
        <atom name="Keys">2249382</atom>
      </tuple>
      <tuple>
        <atom name="Keys">2249396</atom>
      </tuple>
    </table>
    <table name="SecDepartment_tab">
      <tuple>
        <atom name="SecDepartment">Action</atom>
      </tuple>
    </table>
  </tuple>

  <!-- Row 4 -->
  <tuple>
    <atom name="irn">15196</atom>
    <atom name="GroupName">FELI Interns 2012</atom>
    <atom name="GroupType">Static</atom>
    <atom name="Query"></atom>
    <table name="Keys_tab">
      <tuple>
        <atom name="Keys">2329588</atom>
      </tuple>
      <tuple>
        <atom name="Keys">2329589</atom>
      </tuple>
      <tuple>
        <atom name="Keys">2329590</atom>
      </tuple>
      <tuple>
        <atom name="Keys">2329591</atom>
      </tuple>
      <tuple>
        <atom name="Keys">2329592</atom>
      </tuple>
      <tuple>
        <atom name="Keys">2329593</atom>
      </tuple>
      <tuple>
        <atom name="Keys">2329594</atom>
      </tuple>
      <tuple>
        <atom name="Keys">2329595</atom>
      </tuple>
      <tuple>
        <atom name="Keys">2329596</atom>
      </tuple>
      <tuple>
        <atom name="Keys">2329597</atom>
      </tuple>
      <tuple>
        <atom name="Keys">2329598</atom>
      </tuple>
      <tuple>
        <atom name="Keys">2329599</atom>
      </tuple>
      <tuple>
        <atom name="Keys">2329600</atom>
      </tuple>
      <tuple>
        <atom name="Keys">2329601</atom>
      </tuple>
      <tuple>
        <atom name="Keys">2329602</atom>
      </tuple>
      <tuple>
        <atom name="Keys">2329603</atom>
      </tuple>
      <tuple>
        <atom name="Keys">2329604</atom>
      </tuple>
      <tuple>
        <atom name="Keys">2329605</atom>
      </tuple>
    </table>
    <table name="SecDepartment_tab">
      <tuple>
        <atom name="SecDepartment">Action</atom>
      </tuple>
    </table>
  </tuple>

  <!-- Row 5 -->
  <tuple>
    <atom name="irn">15291</atom>
    <atom name="GroupName">FELI Interns 2013</atom>
    <atom name="GroupType">Static</atom>
    <atom name="Query"></atom>
    <table name="Keys_tab">
      <tuple>
        <atom name="Keys">2355348</atom>
      </tuple>
      <tuple>
        <atom name="Keys">2355349</atom>
      </tuple>
      <tuple>
        <atom name="Keys">2355350</atom>
      </tuple>
      <tuple>
        <atom name="Keys">2355351</atom>
      </tuple>
      <tuple>
        <atom name="Keys">2355352</atom>
      </tuple>
      <tuple>
        <atom name="Keys">2355353</atom>
      </tuple>
      <tuple>
        <atom name="Keys">2355354</atom>
      </tuple>
      <tuple>
        <atom name="Keys">2355355</atom>
      </tuple>
      <tuple>
        <atom name="Keys">2355356</atom>
      </tuple>
      <tuple>
        <atom name="Keys">2355357</atom>
      </tuple>
      <tuple>
        <atom name="Keys">2360215</atom>
      </tuple>
      <tuple>
        <atom name="Keys">2360216</atom>
      </tuple>
      <tuple>
        <atom name="Keys">2360217</atom>
      </tuple>
      <tuple>
        <atom name="Keys">2360218</atom>
      </tuple>
    </table>
    <table name="SecDepartment_tab">
      <tuple>
        <atom name="SecDepartment">Action</atom>
      </tuple>
    </table>
  </tuple>

  <!-- Row 6 -->
  <tuple>
    <atom name="irn">15660</atom>
    <atom name="GroupName">Action Midwest Conservation 2012</atom>
    <atom name="GroupType">Static</atom>
    <atom name="Query"></atom>
    <table name="Keys_tab">
      <tuple>
        <atom name="Keys">2407907</atom>
      </tuple>
      <tuple>
        <atom name="Keys">2407908</atom>
      </tuple>
      <tuple>
        <atom name="Keys">2407909</atom>
      </tuple>
      <tuple>
        <atom name="Keys">2407910</atom>
      </tuple>
      <tuple>
        <atom name="Keys">2407911</atom>
      </tuple>
      <tuple>
        <atom name="Keys">2407912</atom>
      </tuple>
      <tuple>
        <atom name="Keys">2407913</atom>
      </tuple>
      <tuple>
        <atom name="Keys">2407914</atom>
      </tuple>
      <tuple>
        <atom name="Keys">2407915</atom>
      </tuple>
      <tuple>
        <atom name="Keys">2407916</atom>
      </tuple>
      <tuple>
        <atom name="Keys">2407917</atom>
      </tuple>
      <tuple>
        <atom name="Keys">2407918</atom>
      </tuple>
      <tuple>
        <atom name="Keys">2407919</atom>
      </tuple>
      <tuple>
        <atom name="Keys">2407920</atom>
      </tuple>
      <tuple>
        <atom name="Keys">2407921</atom>
      </tuple>
      <tuple>
        <atom name="Keys">2407922</atom>
      </tuple>
    </table>
    <table name="SecDepartment_tab">
      <tuple>
        <atom name="SecDepartment">Action</atom>
      </tuple>
    </table>
  </tuple>

  <!-- Row 7 -->
  <tuple>
    <atom name="irn">15663</atom>
    <atom name="GroupName">Chicago Center for Green Technology Tour</atom>
    <atom name="GroupType">Static</atom>
    <atom name="Query"></atom>
    <table name="Keys_tab">
      <tuple>
        <atom name="Keys">2407931</atom>
      </tuple>
    </table>
    <table name="SecDepartment_tab">
      <tuple>
        <atom name="SecDepartment">Action</atom>
      </tuple>
    </table>
  </tuple>

  <!-- Row 8 -->
  <tuple>
    <atom name="irn">15664</atom>
    <atom name="GroupName">Action Summer Intern 2012</atom>
    <atom name="GroupType">Static</atom>
    <atom name="Query"></atom>
    <table name="Keys_tab">
      <tuple>
        <atom name="Keys">2407985</atom>
      </tuple>
      <tuple>
        <atom name="Keys">2407986</atom>
      </tuple>
      <tuple>
        <atom name="Keys">2407987</atom>
      </tuple>
      <tuple>
        <atom name="Keys">2407988</atom>
      </tuple>
    </table>
    <table name="SecDepartment_tab">
      <tuple>
        <atom name="SecDepartment">Action</atom>
      </tuple>
    </table>
  </tuple>

  <!-- Row 9 -->
  <tuple>
    <atom name="irn">15991</atom>
    <atom name="GroupName">Images_HoChunk_26240</atom>
    <atom name="GroupType">Static</atom>
    <atom name="Query"></atom>
    <table name="Keys_tab">
      <tuple>